{
	"schemaVersion": 1,
	"generatedFrom": {
		"easel": {
			"surface": "easel",
			"version": "0.6.1",
			"manifest": "api-compat/generated/manifests/easel-0.6.1.json"
		},
		"three": {
			"surface": "three-addons",
			"version": "0.185.1",
			"manifest": "api-compat/generated/manifests/three-addons-0.185.1.json"
		}
	},
	"comparisons": [
		{
			"source": {
				"id": "easel:AffineUVSampler",
				"name": "AffineUVSampler",
				"surface": "easel"
			},
			"status": "easel-only",
			"notes": []
		},
		{
			"source": {
				"id": "easel:AmbientLight",
				"name": "AmbientLight",
				"surface": "easel"
			},
			"status": "unknown",
			"notes": []
		},
		{
			"source": {
				"id": "easel:AnimationAction",
				"name": "AnimationAction",
				"surface": "easel"
			},
			"status": "unknown",
			"notes": []
		},
		{
			"source": {
				"id": "easel:AnimationClip",
				"name": "AnimationClip",
				"surface": "easel"
			},
			"status": "unknown",
			"notes": []
		},
		{
			"source": {
				"id": "easel:AnimationLoader",
				"name": "AnimationLoader",
				"surface": "easel"
			},
			"status": "unknown",
			"notes": []
		},
		{
			"source": {
				"id": "easel:AnimationUtils",
				"name": "AnimationUtils",
				"surface": "easel"
			},
			"status": "unknown",
			"notes": []
		},
		{
			"source": {
				"id": "easel:Animator",
				"name": "Animator",
				"surface": "easel"
			},
			"status": "unknown",
			"notes": []
		},
		{
			"source": {
				"id": "easel:ArcCurve",
				"name": "ArcCurve",
				"surface": "easel"
			},
			"status": "unknown",
			"notes": []
		},
		{
			"source": {
				"id": "easel:Attribute",
				"name": "Attribute",
				"surface": "easel"
			},
			"status": "unknown",
			"notes": []
		},
		{
			"source": {
				"id": "easel:AxesHelper",
				"name": "AxesHelper",
				"surface": "easel"
			},
			"status": "unknown",
			"notes": []
		},
		{
			"source": {
				"id": "easel:BasicMaterial",
				"name": "BasicMaterial",
				"surface": "easel"
			},
			"status": "unknown",
			"notes": []
		},
		{
			"source": {
				"id": "easel:Binding",
				"name": "Binding",
				"surface": "easel"
			},
			"status": "unknown",
			"notes": []
		},
		{
			"source": {
				"id": "easel:Bone",
				"name": "Bone",
				"surface": "easel"
			},
			"status": "unknown",
			"notes": []
		},
		{
			"source": {
				"id": "easel:BooleanTrack",
				"name": "BooleanTrack",
				"surface": "easel"
			},
			"status": "unknown",
			"notes": []
		},
		{
			"source": {
				"id": "easel:Box2",
				"name": "Box2",
				"surface": "easel"
			},
			"status": "unknown",
			"notes": []
		},
		{
			"source": {
				"id": "easel:Box3",
				"name": "Box3",
				"surface": "easel"
			},
			"status": "unknown",
			"notes": []
		},
		{
			"source": {
				"id": "easel:BoxGeometry",
				"name": "BoxGeometry",
				"surface": "easel"
			},
			"status": "unknown",
			"notes": []
		},
		{
			"source": {
				"id": "easel:BoxHelper",
				"name": "BoxHelper",
				"surface": "easel"
			},
			"status": "unknown",
			"notes": []
		},
		{
			"source": {
				"id": "easel:CanvasTexture",
				"name": "CanvasTexture",
				"surface": "easel"
			},
			"status": "unknown",
			"notes": []
		},
		{
			"source": {
				"id": "easel:CapsuleGeometry",
				"name": "CapsuleGeometry",
				"surface": "easel"
			},
			"status": "unknown",
			"notes": []
		},
		{
			"source": {
				"id": "easel:CatmullRomCurve3",
				"name": "CatmullRomCurve3",
				"surface": "easel"
			},
			"status": "unknown",
			"notes": []
		},
		{
			"source": {
				"id": "easel:Clock",
				"name": "Clock",
				"surface": "easel"
			},
			"status": "unknown",
			"notes": []
		},
		{
			"source": {
				"id": "easel:Color",
				"name": "Color",
				"surface": "easel"
			},
			"status": "unknown",
			"notes": []
		},
		{
			"source": {
				"id": "easel:ColorTable",
				"name": "ColorTable",
				"surface": "easel"
			},
			"status": "easel-only",
			"notes": []
		},
		{
			"source": {
				"id": "easel:ColorTrack",
				"name": "ColorTrack",
				"surface": "easel"
			},
			"status": "unknown",
			"notes": []
		},
		{
			"source": {
				"id": "easel:ConeGeometry",
				"name": "ConeGeometry",
				"surface": "easel"
			},
			"status": "unknown",
			"notes": []
		},
		{
			"source": {
				"id": "easel:CubicBezierCurve",
				"name": "CubicBezierCurve",
				"surface": "easel"
			},
			"status": "unknown",
			"notes": []
		},
		{
			"source": {
				"id": "easel:CubicBezierCurve3",
				"name": "CubicBezierCurve3",
				"surface": "easel"
			},
			"status": "unknown",
			"notes": []
		},
		{
			"source": {
				"id": "easel:Curve",
				"name": "Curve",
				"surface": "easel"
			},
			"status": "unknown",
			"notes": []
		},
		{
			"source": {
				"id": "easel:CurvePath",
				"name": "CurvePath",
				"surface": "easel"
			},
			"status": "unknown",
			"notes": []
		},
		{
			"source": {
				"id": "easel:CylinderGeometry",
				"name": "CylinderGeometry",
				"surface": "easel"
			},
			"status": "unknown",
			"notes": []
		},
		{
			"source": {
				"id": "easel:Cylindrical",
				"name": "Cylindrical",
				"surface": "easel"
			},
			"status": "unknown",
			"notes": []
		},
		{
			"source": {
				"id": "easel:DashedLineMaterial",
				"name": "DashedLineMaterial",
				"surface": "easel"
			},
			"status": "unknown",
			"notes": []
		},
		{
			"source": {
				"id": "easel:DataTexture",
				"name": "DataTexture",
				"surface": "easel"
			},
			"status": "unknown",
			"notes": []
		},
		{
			"source": {
				"id": "easel:DataTextureLoader",
				"name": "DataTextureLoader",
				"surface": "easel"
			},
			"status": "unknown",
			"notes": []
		},
		{
			"source": {
				"id": "easel:DefaultLoadingManager",
				"name": "DefaultLoadingManager",
				"surface": "easel"
			},
			"status": "unknown",
			"notes": []
		},
		{
			"source": {
				"id": "easel:DepthBuffer",
				"name": "DepthBuffer",
				"surface": "easel"
			},
			"status": "easel-only",
			"notes": []
		},
		{
			"source": {
				"id": "easel:DirectionalLight",
				"name": "DirectionalLight",
				"surface": "easel"
			},
			"status": "unknown",
			"notes": []
		},
		{
			"source": {
				"id": "easel:DirectionalLightHelper",
				"name": "DirectionalLightHelper",
				"surface": "easel"
			},
			"status": "unknown",
			"notes": []
		},
		{
			"source": {
				"id": "easel:DodecahedronGeometry",
				"name": "DodecahedronGeometry",
				"surface": "easel"
			},
			"status": "unknown",
			"notes": []
		},
		{
			"source": {
				"id": "easel:DrawCall",
				"name": "DrawCall",
				"surface": "easel"
			},
			"status": "easel-only",
			"notes": []
		},
		{
			"source": {
				"id": "easel:DrawList",
				"name": "DrawList",
				"surface": "easel"
			},
			"status": "easel-only",
			"notes": []
		},
		{
			"source": {
				"id": "easel:DrawPrioritySorter",
				"name": "DrawPrioritySorter",
				"surface": "easel"
			},
			"status": "easel-only",
			"notes": []
		},
		{
			"source": {
				"id": "easel:earcut",
				"name": "earcut",
				"surface": "easel"
			},
			"status": "easel-only",
			"notes": []
		},
		{
			"source": {
				"id": "easel:EdgesGeometry",
				"name": "EdgesGeometry",
				"surface": "easel"
			},
			"status": "unknown",
			"notes": []
		},
		{
			"source": {
				"id": "easel:EdgeWalker",
				"name": "EdgeWalker",
				"surface": "easel"
			},
			"status": "easel-only",
			"notes": []
		},
		{
			"source": {
				"id": "easel:EllipseCurve",
				"name": "EllipseCurve",
				"surface": "easel"
			},
			"status": "unknown",
			"notes": []
		},
		{
			"source": {
				"id": "easel:Euler",
				"name": "Euler",
				"surface": "easel"
			},
			"status": "unknown",
			"notes": []
		},
		{
			"source": {
				"id": "easel:EventDispatcher",
				"name": "EventDispatcher",
				"surface": "easel"
			},
			"status": "unknown",
			"notes": []
		},
		{
			"source": {
				"id": "easel:ExtrudeGeometry",
				"name": "ExtrudeGeometry",
				"surface": "easel"
			},
			"status": "unknown",
			"notes": []
		},
		{
			"source": {
				"id": "easel:FileLoader",
				"name": "FileLoader",
				"surface": "easel"
			},
			"status": "unknown",
			"notes": []
		},
		{
			"source": {
				"id": "easel:FlatShader",
				"name": "FlatShader",
				"surface": "easel"
			},
			"status": "easel-only",
			"notes": []
		},
		{
			"source": {
				"id": "easel:Fog",
				"name": "Fog",
				"surface": "easel"
			},
			"status": "unknown",
			"notes": []
		},
		{
			"source": {
				"id": "easel:FogCuller",
				"name": "FogCuller",
				"surface": "easel"
			},
			"status": "easel-only",
			"notes": []
		},
		{
			"source": {
				"id": "easel:Framebuffer",
				"name": "Framebuffer",
				"surface": "easel"
			},
			"status": "easel-only",
			"notes": []
		},
		{
			"source": {
				"id": "easel:FramebufferClear",
				"name": "FramebufferClear",
				"surface": "easel"
			},
			"status": "easel-only",
			"notes": []
		},
		{
			"source": {
				"id": "easel:FramebufferTexture",
				"name": "FramebufferTexture",
				"surface": "easel"
			},
			"status": "unknown",
			"notes": []
		},
		{
			"source": {
				"id": "easel:FramebufferUpload",
				"name": "FramebufferUpload",
				"surface": "easel"
			},
			"status": "easel-only",
			"notes": []
		},
		{
			"source": {
				"id": "easel:Frustum",
				"name": "Frustum",
				"surface": "easel"
			},
			"status": "unknown",
			"notes": []
		},
		{
			"source": {
				"id": "easel:Geometry",
				"name": "Geometry",
				"surface": "easel"
			},
			"status": "unknown",
			"notes": []
		},
		{
			"source": {
				"id": "easel:GeometryLoader",
				"name": "GeometryLoader",
				"surface": "easel"
			},
			"status": "unknown",
			"notes": []
		},
		{
			"source": {
				"id": "easel:GouraudInterpolator",
				"name": "GouraudInterpolator",
				"surface": "easel"
			},
			"status": "easel-only",
			"notes": []
		},
		{
			"source": {
				"id": "easel:GouraudShader",
				"name": "GouraudShader",
				"surface": "easel"
			},
			"status": "easel-only",
			"notes": []
		},
		{
			"source": {
				"id": "easel:GridHelper",